id,name,japanese_name,aka,class,stars,gender,strength,endurance,agility,mana,luck,np,cost,min_attack,max_attack,grail_atk,min_hp,max_hp,grail_hp,voice_actor,illustrator,attribute,growth_curve,star_absorption,star_generation,np_charge_atk,np_charge_def,death_rate,alignments,traits,cards
152,Solomon (True),ソロモン,"True Solomon, King of Magic,  Romani Archaman",Caster,5.0,Male,E,E,B,A++,A++,A+++,16,1645,10650.0,11658.0,2091,14259.0,15621.0,Suzumura Kenichi,Takeuchi Takashi,Earth,Linear,51,11%,0%,0%,33%,Lawful・Good,"Humanoid, Male, Servant, Weak to Enuma Elish",QAABB
153,Miyamoto Musashi,宮本武蔵;  新免武蔵守藤原玄信,"Flower of Tengen  ( 天元の花,  Tengen no Hana ? ), Shinmen Musashi no Kami Fujiwara no Harunobu Bennosuke (弁之助), Niten Dōraku (二天道楽), Shinmen Takezō",Saber,5.0,Female,B,B,B,E,B,B,16,1860,12037.0,13176.0,1999,13635.0,14938.0,Sakura Ayane,Koyama Hirokazu,Man,Linear,100,10%,0.87%,3%,35%,Chaotic・Good,"Female, Humanoid, Servant, Weak to Enuma Elish",QABBB
154,"""The Old Man of the Mountain""","""山の翁""","King Hassan, First Hassan, Hassan-i Sabbah",Assassin,5.0,Male,B,A,B,E,E,A,16,1831,11848.0,12969.0,1956,13338.0,14612.0,Nakata Jouji,Ryota-H,Man,S,98,25.5%,1%,4%,49.5%,Lawful・Evil,"Brynhildr's Beloved, Humanoid, Servant, Male, Weak to Enuma Elish",QABBB
155,Mysterious Heroine X (Alter),謎のヒロインＸ〔オルタ〕,"MHX Alter, MHXA, Ecchan",Berserker,5.0,Female,A,B,B,A+,C,A++,16,1717,11113.0,12165.0,2079,14175.0,15529.0,Kawasumi Ayako,BUNBUN,Star,Semi S,9,5%,1.07%,5%,37.3%,Neutral・Evil,"Arthur, Dragon, Female, Humanoid, King, Saberface, Servant",QQABB
156,James Moriarty,ジェームズ・モリアーティ,"Archer of Shinjuku  ( 新宿のアーチャー ? ), Professor Moriarty, The  Napoléon  of Crime",Archer,5.0,Male,C,D,A,B,A,C,16,1820,11781.0,12896.0,2007,13685.0,14992.0,Hashi Takaya,Honjou Raita,Man,Semi S,153,8%,0.38%,3%,31.5%,Chaotic・Evil,"Costume-Owning, Humanoid, Male, Servant, Weak to Enuma Elish",QAAAB
157,EMIYA (Alter),エミヤ〔オルタ〕,"Emiya Shirou  ( 衛宮士郎,  Emiya Shirō ? ), Detroit Emiya, Demiya, Edgemiya, Edgy Emiya",Archer,4.0,Male,C,B,D,B,E,?,12,1499,8996.0,10892.0,1960,12250.0,14853.0,Suwabe Junichi,Sasaki Shonen,Man,Linear,145,7.9%,0.43%,3%,31.5%,Chaotic・Evil,"Humanoid, Male, Servant, Weak to Enuma Elish",QQAAB
158,Hessian Lobo,ヘシアン・ロボ,"Avenger of Shinjuku  ( 新宿のアヴェンジャー ? ),  Rider of Shinjuku  ( 新宿のライダー ? ), King of Currumpaw (Wolf), Hesse",Avenger,4.0,Male,A+,B+,A+,E,D,B+,12,1771,10628.0,12868.0,1591,9949.0,12063.0,Takeuchi Ryouta,Simosi,Earth,Semi S,29,6%,0.79%,5%,10%,Chaotic・Evil,"Beast, Demonic Beast Servants, Humanoid, Male, Servant, Weak To Enuma Elish",QQAAB
159,Yan Qing,燕青,"Assassin of Shinjuku  ( 新宿のアサシン ? ), Langzi (Wanderer / Prodigal), Ensei, Shinshin-san, Doppelgänger",Assassin,4.0,Male,B,D,A+,D,B,D,12,1443,8661.0,10487.0,1862,11637.0,14110.0,Okamoto Nobuhiko,Shimaudon,Man,Semi Reverse S,100,25.6%,0.71%,4%,49.5%,Chaotic・Evil,"Brynhildr's Beloved, Humanoid, Male, Servant, Weak to Enuma Elish",QQQAB
160,Arthur Pendragon (Prototype),アーサー・ペンドラゴン〔プロトタイプ〕,"Knight, Proto Saber, King of Knights, King Arthur",Saber,5.0,Male,A,A+,B,B,B,EX,16,1926,12465.0,13645.0,2049,13975.0,15310.0,Sakurai Takahiro,Nakahara,Earth,Linear,100,10%,0.84%,3%,24.5%,Lawful・Good,"Arthur, Brynhildr's Beloved, Costume-Owning, Dragon, Humanoid, King, Male, Riding, Servant, Weak to Enuma Elish",QAABB
161,Hijikata Toshizō,土方歳三,"Hijikata Toshizou, Demon of the Battlefield; Berserker of Bakumatsu Period; Vice Captain of Shinsengumi",Berserker,5.0,Male,C,C,C,E,D,C+,16,1868,12089.0,13234.0,1764,12028.0,13178.0,Hoshino Takanori,Yogo Yūki,Man,Linear,9,4.9%,1.08%,5%,65%,Lawful・Evil,"Humanoid, Male, Servant, Weak to Enuma Elish",QQABB
162,Chacha,茶々,Yodo-dono  ( 淀殿 ? ),Berserker,4.0,Female,D,D,D,C,B,C,12,1490,8945.0,10831.0,1764,11025.0,13368.0,Asumi Kana,pako,Man,Semi Reverse S,10,4.9%,1.03%,5%,52%,Chaotic・Neutral,"Children Servants, Female, Humanoid, Servant, Weak to Enuma Elish",QABBB
163,Meltlilith,メルトリリス,"Alter Ego S, Meltryllis,  Artemis , Lotan, Sarasvati",Alter Ego,5.0,Female,E,C,A+,A,B,EX,16,1807,11692.0,12799.0,1965,13402.0,14682.0,Hayami Saori,Wada Arco,Earth,Linear,100,10.2%,0.92%,4%,30%,Lawful・Good,"Divine, Female, Humanoid, Mechanical, Riding, Servant, Weak to Enuma Elish",QQABB
164,Passionlip,パッションリップ,"Alter Ego M,  Parvati ,  Brynhildr , Durga",Alter Ego,4.0,Female,A+,A,C,B,E,C,12,1716,10299.0,12470.0,1744,10901.0,13217.0,Ogura Yui,Wada Arco,Earth,Semi Reverse S,97,9.9%,0.77%,4%,35%,Lawful・Neutral,"Divine, Female, Humanoid, Mechanical, Servant, Weak to Enuma Elish",QABBB
165,Suzuka Gozen,鈴鹿御前,"Tate Eboshi, JK Saber",Saber,4.0,Female,D,D,A,A,B,EX,12,1590,9544.0,11556.0,1880,11753.0,14250.0,Touyama Nao,Takenoko Seijin,Sky,Semi S,100,10.2%,0.57%,3%,21%,Neutral・Evil,"Divine, Female, Humanoid, Oni, Riding, Servant, Weak to Enuma Elish",QAABB
166,B B,BB,Mysterious Black Magus,Moon Cancer,4.0,Female,E,C,D,A,EX,A,12,1366,8197.0,9925.0,2182,13643.0,16542.0,Shitaya Noriko,Wada Arco,Man,Linear,52,14.7%,0.61%,3%,0.6%,Chaotic・Good,"Female, Humanoid, Mechanical, Servant, Weak to Enuma Elish",QQAAB
167,Sesshōin Kiara,殺生院キアラ,"Sessyoin Kiara, Sesshouin Kiara,  Demonic Bodhisattva , Last Prophet,  Beast III/R",Alter Ego,5.0,Female,D,A+,B+,EX,E,EX,16,1803,11668.0,12772.0,2142,14606.0,16001.0,Tanaka Rie,Wada Arco,Beast,Semi S,97,10%,0.55%,4%,25%,Chaotic・Evil,"Female, Humanoid, Servant, Weak to Enuma Elish",QAABB
168,Beast III/R,ビーストIII／R; 殺生院キアラ; 魔性菩薩; ヘブンズホール,"Heaven's Hole,  Sesshōin Kiara ,  Demonic Bodhisattva , Pleasure Deva, Rapture",Beast III,5.0,Female,C,EX,B,EX,A,EX,16,13728,,15027.0,18720,,20509.0,Tanaka Rie,Wada Arco,Beast,Semi S,102,10%,0.55%,3%,0%,Chaotic・Evil,"Demonic, Giant  (Demonic Bodhisattva) , Female, Humanoid  (Heaven's Hole) , Super Large  (Demonic Bodhisattva)",QAABB
169,Scheherazade,シェヘラザード,"Caster of Nightless City  ( 不夜城のキャスター ? ), Shahrazad (Persian)",Caster,5.0,Female,E,D,E,C,EX,EX,16,1423,9212.0,10084.0,2324,15846.0,17360.0,Inoue Kikuko,Namaniku ATK (Nitroplus),Man,Semi S,52,10.8%,0.51%,3%,48%,Lawful・Neutral,"Female, Humanoid, Servant, Weak to Enuma Elish",QAAAB
170,Wu Zetian,武則天,"Assassin of Nightless City  ( 不夜城のアサシン ? ), Fūyā-chan, Nite Brite, Bu Sokuten",Assassin,4.0,Female,D,E,A,B,A,B,12,1496,8981.0,10874.0,1750,10942.0,13267.0,Izawa Shiori,Harada Takehito,Man,Reverse S,102,25.5%,0.87%,4%,38.5%,Lawful・Evil,"Children Servants, Female, Humanoid, King, Servant, Weak to Enuma Elish",QQABB
171,Penthesilea,ペンテシレイア,"Berserker of El Dorado  ( エルドラドのバーサーカー ? ), Amazoness CEO",Berserker,4.0,Female,A+,B+,C,A,D,A,12,1750,10502.0,12716.0,1628,10175.0,12337.0,Shimamura Yuu,Shinjirō,Earth,Linear,10,4.9%,1.07%,5%,39%,Lawful・Good,"Costume-Owning, Divine, Female, Humanoid, King, Servant, Weak to Enuma Elish",QABBB
172,Christopher Columbus,クリストファー・コロンブス,"Rider of Resistance  ( レジスタンスのライダー ? ), Cristoforo Colombo, Cristóbal Colón",Rider,3.0,Male,C,B,D,E,EX,A,7,1216,6552.0,8867.0,1728,9600.0,13016.0,Ootsuka Houchuu,Moto Murabito,Man,Linear,208,8.9%,0.55%,3%,50%,Neutral・Evil,"Humanoid, Male, Riding, Servant, Weak to Enuma Elish",QAABB
173,Sherlock Holmes,シャーロック・ホームズ,"The One who Illuminates the Truth  ( 真実を照らす者,  Shinjitsu wo Terasu mono ? ), Holmes",Ruler,5.0,Male,D,C,B+,B,A++,B,16,1776,11495.0,12583.0,1960,13365.0,14642.0,Mizushima Takahiro,Yamanaka Kotetsu,Star,Linear,100,10%,0.76%,3%,24.5%,Neutral・Good,"Humanoid, Male, Servant",QQAAB
174,Paul Bunyan,ポール・バニヤン,Berserker of Learning with Manga,Berserker,1.0,Female,C,A,C,E,E,C,3,1099,6044.0,9391.0,1239,6196.0,9551.0,Omigawa Chiaki,Riyo,Earth,Semi Reverse S,9,4.9%,0.67%,5%,65%,True Neutral,"Children Servants, Costume-Owning, Female, Giant, Humanoid, Servants, Weak to Enuma Elish",QABBB
175,Nero Claudius (Caster),ネロ・クラウディウス,,Caster,5.0,Female,D,D,A,B,A,A,16,1677,10857.0,11885.0,2007,13685.0,14992.0,Tange Sakura,Wada Arco,Man,S,51,11.1%,0.40%,3%,42%,Chaotic・Summer,"Female, Humanoid, King, Riding, Roman, Saberface, Servant, Weak to Enuma Elish",QAABB
176,Frankenstein (Saber),フランケンシュタイン,,Saber,4.0,Female,C++,B,C,D,A,B,12,1558,9353.0,11325.0,1919,11993.0,14541.0,Nonaka Ai,Okazaki Takeshi,Earth,Linear,102,9.9%,0.70%,3%,31.5%,Neutral・Summer,"Female, Humanoid, Mechanical, Riding, Servant, Weak to Enuma Elish",QQABB
177,Nitocris (Assassin),ニトクリス,,Assassin,4.0,Female,E,E,B,A,A,B,12,1468,8812.0,10670.0,1843,11518.0,13965.0,Tanaka Minami,Shimaudon,Sky,Reverse S,102,25%,0.78%,3%,33%,Lawful・Good,"Divine, Female, Humanoid, King, Servant, Weak to Enuma Elish",QQAAB
178,Oda Nobunaga (Berserker),織田信長,,Berserker,4.0,Female,B,C,B,C,B,?,12,1691,10146.0,12285.0,1603,10023.0,12153.0,Kugimiya Rie,pako,Man,S,10,5.0%,0.93%,5.00%,52%,Chaotic・Summer,"Female, Humanoid, King, Nobunaga, Servant, Weak to Enuma Elish",QABBB
179,Artoria Pendragon (Rider Alter),アルトリア・ペンドラゴン〔オルタ〕,"Maid Alter, Demonic Chief Maid, King of Maids",Rider,5.0,Female,B,C,B,A,B,A,16,1665,10776.0,11796.0,2090,14256.0,15618.0,Kawasumi Ayako,Takeuchi Takashi,Man,Linear,200,9%,0.59%,3%,30%,Lawful・Evil,"Arthur, Dragon, Female, Humanoid, King, Riding, Saberface, Servant, Weak to Enuma Elish",QQAAB
180,Helena Blavatsky (Archer),エレナ・ブラヴァツキー,Elena Blavatsky,Archer,4.0,Female,E,D,B,A,A,B+,12,1574,9446.0,11437.0,1824,11404.0,13827.0,Kanemoto Hisako,MatsuRyuu,Man,Linear,153,8%,0.38%,3%,27%,Chaotic・Good,"Female, Humanoid, Servant, Weak to Enuma Elish",QQAAB
181,Minamoto no Raikō (Lancer),源頼光,"Minamoto no Yorimitsu, Minamoto no Raikou",Lancer,4.0,Female,C,B,D,A,C,A+,12,1528,9168.0,11100.0,1938,12112.0,14686.0,Tomatsu Haruka,Honjou Raita,Sky,Linear,89,11.8%,0.75%,4.00%,24%,Lawful・Good,"Divine, Female, Genji, Humanoid, Riding, Servant, Weak to Enuma Elish",QQABB
182,Ishtar (Rider),イシュタル,"Inanna, Mistress of Heaven,  Tohsaka Rin  ( 遠坂凛,  Tōsaka Rin ? )",Rider,4.0,Female,C,C,A,B,B,EX,12,1600,9603.0,11627.0,1710,10692.0,12964.0,Ueda Kana,Morii Shizuki,Sky,Reverse S,200,9%,0.68%,3%,35%,Lawful・Good,"Divine, Female, Humanoid, Living Human, Pseudo-Servant, Riding, Servant, Weak to Enuma Elish",QQAAB
183,Parvati,パールヴァティー,"Par, Pārvatī,  Matou Sakura  ( 間桐桜,  Matō Sakura ? ),  Goddess Uma  ( 烏摩妃,  Umahi ? ), Loka Mata",Lancer,4.0,Female,D,C,D,B,B,EX,12,1354,8127.0,9840.0,2120,13253.0,16069.0,Shitaya Noriko,Aotsuki Takao,Sky,Semi-S,90,11.8%,1.08%,4%,28%,Lawful・Good,"Costume-Owning, Divine, Female, Humanoid, Living Human, Pseudo-Servant, Servant, Weak to Enuma Elish",QQABB
184,Tomoe Gozen,巴御前,Archer Inferno  ( アーチャー・インフェルノ ? ),Archer,4.0,Female,C,D,C,B,A,B+,12,1657,9946.0,12043.0,1728,10804.0,13100.0,Kanemoto Hisako,Shirabi,Earth,S,153,7.9%,0.87%,3%,31.5%,True Neutral,"Demonic, Female, Genji, Humanoid, Oni, Servant, Weak to Enuma Elish",QAABB
185,Mochizuki Chiyome,望月千代女,Assassin Paraíso  ( アサシン・パライソ ? ),Assassin,4.0,Female,D,D,A,C,C,C,12,1418,8510.0,10304.0,1862,11637.0,14110.0,Sakura Ayane,Hiroyama Hiroshi,Earth,Linear,99,25.5%,0.8%,4%,44%,Chaotic・Evil,"Female, Humanoid, Servant, Weak to Enuma Elish",QQAAB
186,Hōzōin Inshun,宝蔵院胤舜,"Houzouin Inshun,  Lancer Purgatorio  ( ランサー・プルガトリオ ? )",Lancer,3.0,Male,C,D,A,D,B,C,7,1261,6791.0,9191.0,1799,9996.0,13553.0,Namikawa Daisuke,MatsuRyuu,Man,Reverse-S,90,12.2%,1.06%,4%,36%,True Neutral,"Brynhildr's Beloved, Humanoid, Male, Servant, Weak to Enuma Elish",QQQAB
187,Yagyū Munenori,柳生但馬守宗矩,"Yagyuu Munenori, Ryūtan, Yagyū Tajima-no-Kami Munenori,  Saber Empíreo",Saber,4.0,Male,B,D,A++,E,B,B,12,1666,9999.0,12107.0,1781,11135.0,13501.0,Yamaji Kazuhiro,Furumi Showichi,Man,Linear,100,10.3%,0.81%,3%,35%,Lawful・Neutral,,QAABB
188,Katō Danzō,加藤段蔵,"Katou Danzou, Katou ""Black Kite"" Danzo, Flying Katou (飛び加藤, 𝘛𝘰𝘣𝘪 𝘒𝘢𝘵ō), Kite Katou",Assassin,4.0,Female,D,D,A,C,B,C,12,1489,8935.0,10818.0,1768,11055.0,13404.0,Akesaka Satomi,Soga Makoto,Earth,Semi-Reverse S,100,25.5%,0.71%,4%,44%,True Neutral,"Female, Humanoid, Mechanical, Servant, Weak to Enuma Elish",QQABB
189,Osakabehime,刑部姫,Okki,Assassin,5.0,Female,E,E,E,A+,A+,A++,16,1672,10824.0,11849.0,2027,13822.0,15143.0,Fukuen Misato,Moriyama Daisuke,Earth,Linear,102,24.6%,0.83%,4%,31.6%,Chaotic・Neutral,"Divine, Female, Humanoid, Servant, Weak to Enuma Elish",QQAAB
190,Mecha Eli-chan,メカエリチャン,Magus Aegis Elizabeth Channel,Alter Ego,4.0,Female,A,A,E,E,E,B,12,1666,9997.0,12104.0,1744,10901.0,13217.0,Ookubo Rumi,Wada Arco,Man,Linear,97,9.7%,0.9%,4%,50%,Lawful・Good,"Female, Humanoid, Mechanical, Servant, Threat to Humanity, Weak to Enuma Elish",QABBB
191,Mecha Eli-chan Mk.II,メカエリチャンⅡ号機,"Magus Aegis Elizabeth Channel II, MK.II",Alter Ego,4.0,Female,A,A,E,E,E,B,12,1666,9997.0,12104.0,1744,10901.0,13217.0,Ookubo Rumi,Wada Arco,Man,Linear,97,9.7%,0.9%,4%,50%,Lawful・Good,"Female, Humanoid, Mechanical, Servant, Threat to Humanity, Weak to Enuma Elish",QABBB
192,Circe,キルケー,Caster of Okeanos  ( オケアノスのキャスター ? ),Caster,4.0,Female,E,B,D,A+,A,C,12,1445,8671.0,10499.0,1960,12250.0,14853.0,Akaneya Himika,Hidari,Sky,Reverse S,51,10.8%,0.39%,3%,34.5%,Chaotic・Neutral,"Argo-Related, Female, Humanoid, Servant, Weak to Enuma Elish",QAAAB
193,Nezha,哪吒,"Nata, Nataku",Lancer,4.0,Female,C+,B,A,B,A,A,12,1547,9284.0,11241.0,1938,12112.0,14686.0,Ogura Yui,Aotsuki Takao,Sky,Linear,91,12.2%,0.72%,4%,28%,Neutral・Good,,QQABB
194,Queen of Sheba,シバの女王,"Caster of Midrash  ( ミドラーシュのキャスター ? ), Bilqis, Makeda, Tituba",Caster,4.0,Female,D,C,D,A,A,B,12,1438,8629.0,10448.0,1940,12127.0,14704.0,Satou Satomi,Katou Itsuwa,Man,Semi Reverse S,51,10.8%,0.81%,3%,36%,Neutral・Good,"Female, Humanoid, King, Servant, Weak to Enuma Elish",QAABB
195,Abigail Williams,アビゲイル・ウィリアムズ,"The Key to the Gate, Sut-Typhon, Yog-Sothoth, All-in-One, One-in-All, Abby",Foreigner,5.0,Female,B,A,C,B,C,A,16,1870,12100.0,13245.0,2019,13770.0,15086.0,Ōwada Hitomi,Kuroboshi Kouhaku,Earth,Semi S,148,14.8%,0.25%,3%,7%,Chaotic・Evil,"Children Servants, Divine, Existence Outside the Domain, Female, Humanoid, Servant, Threat to Humanity",QAAAB
196,Ereshkigal,エレシュキガル,"The Goddess of the Netherworld,  Tohsaka Rin  ( 遠坂凛,  Tōsaka Rin ? )",Lancer,5.0,Female,A,B,D,B,B,A,16,1598,10343.0,11322.0,2356,16065.0,17600.0,Ueda Kana,Morii Shizuki,Earth,Semi-S,90,11.8%,0.54%,4%,28%,Chaotic・Evil,"Divine, Female, Humanoid, King, Pseudo-Servant, Servant, Weak to Enuma Elish",QQABB
197,Altera the San(ta),アルテラ・ザ・サン〔タ〕,"Attila Santa, Etzel, Santera",Archer,4.0,Female,C,B,A+,A,A,EX,12,1626,9759.0,11816.0,1862,11637.0,14110.0,Noto Mamiko,huke,Star,Linear,153,8.1%,0.59%,3%,27%,Chaotic・Good,"Divine, Female, Humanoid, King, Riding, Servant",QQAAB
198,Katsushika Hokusai,葛飾北斎,"Katsushika Oui  ( 葛飾 応為,  Katsushika Ōi ? , Daughter ); Tokitarō, Toto-sama, Extraterrestrial Octopus, Darusen,  The Old Man Mad About Art Manji  ( 画狂老人卍,  Gakyō Rōjin Manji ? , Last renamed name ), Cthulhu",Foreigner,5.0,Female,D,D,B,B,A,A,16,1870,12100.0,13245.0,1940,13230.0,14494.0,Yukana Nogami,Kuroboshi Kouhaku,Man,S,153,15%,0.33%,3%,7%,Chaotic・Neutral,"Divine, Existence Outside the Domain, Female, Humanoid, Servant, Threat to Humanity, Weak to Enuma Elish",QAABB
199,Semiramis,セミラミス,"Empress of Assyria  ( アッシリアの女帝,  Asshiria no Jotei ? ) Assassin of Red",Assassin,5.0,Female,E,D,D,A,A,B,16,1747,11309.0,12379.0,1945,13266.0,14533.0,Shindou Kei,Konoe Ototsugu,Earth,S,102,24.7%,0.39%,4%,33%,Lawful・Evil,"Divine, Female, Humanoid, King, Servant, Weak to Enuma Elish",QAAAB
200,Asagami Fujino,浅上藤乃,Fujinon,Archer,4.0,Female,E,B,D,A,C,EX,12,1716,10299.0,12470.0,1764,11025.0,13368.0,Noto Mamiko,Takeuchi Takashi,Man,Reverse S,148,7.9%,0.59%,3%,27%,Lawful・Evil,"Female, Humanoid, Living Human, Pseudo-Servants, Servant",QAABB
201,Anastasia Nikolaevna Romanova,アナスタシア・ニコラエヴナ・ロマノヴァ,"Grand Duchess of Russia,  Grand Duchess of the Beast Nation  ( 獣国の皇女 ? )",Caster,5.0,Female,E,E,C,A,D,C,16,1629,10546.0,11544.0,2091,14259.0,15621.0,Hara Yumi,sime,Man,S,49,10.8%,0.51%,3%,36%,True Neutral,"Female, Humanoid, Servant, Weak to Enuma Elish",QAAAB
202,Atalanta (Alter),アタランテ〔オルタ〕,,Berserker,4.0,Female,C++,C++,A+,B,E,B+,12,1634,9806.0,11873.0,1701,10634.0,12894.0,Hayami Saori,Konoe Ototsugu,Earth,Linear,9,5.1%,1.05%,5%,45.5%,Chaotic・Evil,"Argo-Related, Beast, Female, Humanoid, Servant, Weak to Enuma Elish",QQABB
203,Avicebron,アヴィケブロン,"Golem Master  ( ゴーレムマスター,  Gōremu Masutā ? ) Solomon ibn Gabirol, Caster of Black",Caster,3.0,Male,E,E,D,A,B,A+,7,1184,6376.0,8629.0,1796,9981.0,13533.0,Miyamoto Mitsuru,Konoe Ototsugu,Man,S,50,10.7%,0.61%,3%,36%,Lawful・Neutral,"Humanoid, Male, Servant, Weak to Enuma Elish",QAAAB
204,Antonio Salieri,アントニオ・サリエリ,"Man in Grey, Amadeus Alter",Avenger,3.0,Male,B,C,A,C,B,C,7,1509,8125.0,10996.0,1411,7840.0,10630.0,Seki Toshihiko,PFALZ,Earth,Linear,30,6.1%,0.7%,5%,8%,Chaotic・Evil,"Brynhildr's Beloved, Humanoid, Male, Servant, Weak to Enuma Elish",QAABB
205,Ivan the Terrible,イヴァン雷帝,Ivan Vasilyevich; Ivan Grozny; Thunderous Emperor; Ivan IV; Ivan the Formidable; Ivan the Fearsome; Grand Prince of Moscow,Rider,5.0,Male,B+,A+,D,C,B,A,16,1795,11619.0,12719.0,1948,13284.0,14553.0,Kuroda Takaya,danciao,Man,Reverse S,200,8.9%,0.62%,3%,40%,Lawful・Evil,"Beast, Giant, Humanoid, King, Male, Riding, Servant, Weak to Enuma Elish",QAABB
206,Achilles,アキレウス,"The Swift Hero  ( 駿足の英雄,  Shunsoku no Eiyū ? ) Rider of Red, Achilleus, Akhilles",Rider,5.0,Male,B+,A,A+,C,D,A+,16,1836,11883.0,13008.0,1938,13219.0,14482.0,Furukawa Makoto,Konoe Ototsugu,Earth,Reverse S,196,9.1%,0.57%,3%,40%,Lawful・Neutral,"Brynhildr's Beloved, Divine, Greek Mythology Males, Humanoid, Male, Riding, Servant, Weak to Enuma Elish",QQAAB
207,Chiron,ケイローン,"Great Sage of Centaurs  ( ケンタウロスの大賢者,  Kentaurosu no Dai Kenja ? ) Archer of Black, Kheiron",Archer,4.0,Male,B,B,A+,B,C,A,12,1549,9294.0,11253.0,1960,12250.0,14853.0,Takeuchi Shunsuke,Konoe Ototsugu,Sky,Reverse S,148,8.1,0.68%,3%,31.5%,Lawful・Good,"Argo-Related, Divine, Greek Mythology Males, Humanoid, Male, Servant, Weak to Enuma Elish",QQAAB
208,Sieg,ジーク,"Homunculus, Detached and Kind Dragon, Evil Dragon  Fafnir",Caster,4.0,Male,E,E,E,D,B,EX,12,1399,8394.0,10163.0,1806,11288.0,13686.0,Hanae Natsuki,Konoe Ototsugu,Man,Linear,50,10.8%,0.78%,3%,54%,Neutral・Good,"Dragon, Humanoid, Male, Servant, Weak to Enuma Elish",QAABB
209,Okita Sōji (Alter),沖田総司〔オルタ〕,"Majin Saber  ( 魔 セイバー ? ), Okita Souji (Alter), Majin・Okita Sōji (魔 ・沖田総司), Devil Okita Sōji Alternative (魔 ・沖田総司オルタナティブ)",Alter Ego,5.0,Female,B,C,A,B,C,A,16,1926,12465.0,13645.0,1862,12696.0,13909.0,Yūki Aoi,Takeuchi Takashi,Man,Semi S,99,10.2%,0.77%,4%,35%,True Neutral,"Brynhildr's Beloved, Female, Humanoid, Saberface, Servant, Weak to Enuma Elish",QQABB
210,Okada Izō,岡田以蔵,"Manslayer Izō  ( 人斬り以蔵,  Hitokiri Izō ? ), Okada Izou, Ghost of Tosa",Assassin,3.0,Male,C,D,B,E,E,C,7,1277,6879.0,9310.0,1592,8844.0,11991.0,Yoshino Hiroyuki,lack,Man,Semi-Reverse S,97,25%,0.79%,4%,55%,Neutral・Evil,"Costume-Owning, Humanoid, Male, Servant, Weak to Enuma Elish",QQAAB
211,Sakamoto Ryōma,坂本龍馬,"Hero of Restoration  ( 維新の英雄,  Ishin no Eiyū ? ), Sakamoto Ryouma",Rider,4.0,Male,C,C,B,D,A-,EX,12,1425,8555.0,10358.0,1900,11880.0,14404.0,"Kase Yasuyuki, Horie Yui",pako,Man,Linear,203,9%,0.56%,3%,45%,True Neutral,"Brynhildr's Beloved, Divine, Humanoid, Male, Riding, Servant, Weak to Enuma Elish",QAABB
212,Napoléon,ナポレオン,"Man of Possibilities  ( 可能性の男,  Kanōsei no Otoko ? ) Napoléon Bonaparte (ナポレオン・ボナパルト), Napoléon I, Emperor of the French, King of Italy,  Good Fellow of Everlasting Flame  ( 消えぬ炎の快男児 ? )",Archer,5.0,Male,D,C,A,E,B,B,16,1859,12033.0,13172.0,1920,13097.0,14348.0,Hino Satoshi,Ryota-H,Star,Linear,150,8%,0.59%,3%,45%,Neutral・Good,"Brynhildr's Beloved, Humanoid, King, Male, Servant",QAABB
213,Sigurd,シグルド,"Siegfried , King of Warriors",Saber,5.0,Male,A+,A+,B,C,E,A++,16,1926,12465.0,13645.0,2049,13975.0,15310.0,Tsuda Kenjirō,Miwa Shirō,Earth,S,97,10%,0.62%,3%,28%,Neutral・Good,"Brynhildr's Beloved, Costume-Owning, Divine, Dragon, Humanoid, Male, Riding, Servant, Weak to Enuma Elish",QAABB
214,Valkyrie,ワルキューレ,"Daughters of the Great God (大神の娘たち), ヴァルキリー,  Walküre , Ortlinde, Hildr, Thrúd (Þrúðr)",Lancer,4.0,Female,B,B,B,A+,E,B,12,1339,8037.0,9731.0,2244,14025.0,17005.0,"Tanaka Minami, Komatsu Mikako, Amamiya Sora",Takeuchi Takashi,Sky,S,87,12%,0.86%,4%,23%,Lawful・Good,"Divine, Female, Humanoid, Servant, Weak to Enuma Elish",QQABB
215,Scáthach-Skaði,スカサハ＝スカディ,"スカサハ＝スカジ, Scathach=Skadi, Scáthach (Caster), Skadi, Queen of Ice and Snow",Caster,5.0,Female,B,D,C,EX,D,A,16,1661,10753.0,11771.0,2112,14406.0,15782.0,Noto Mamiko,Koyama Hirokazu,Sky,Linear,49,10.8%,0.67%,3%,30%,Chaotic・Good,"Divine, Female, Humanoid, King, Servant, Weak to Enuma Elish",QQAAB
216,Jeanne d'Arc (Archer),ジャンヌ・ダルク,,Archer,5.0,Female,C,A,B+,C,A,A,16,1626,10525.0,11521.0,2309,15743.0,17247.0,Sakamoto Maaya,Takeuchi Takashi,Man,Linear,153,8%,0.68%,3%,36%,Lawful・Summer,"Female, Humanoid, Saberface, Servant, Weak to Enuma Elish",QAABB
217,Ibaraki Dōji (Lancer),茨木童子,"Ibaraki-Douji (Lancer), Banana Oni",Lancer,4.0,Female,B+,A,D+,D,B,B,12,1522,9133.0,11058.0,1976,12354.0,14979.0,Touyama Nao,Hidari,Earth,Semi S,90,11.7%,1.06%,4%,36%,Chaotic・Evil,"Children Servants, Demonic, Female, Humanoid, Oni, Servant, Weak to Enuma Elish",QQABB
218,Ushiwakamaru (Assassin),牛若丸,Minamoto no Yoshitsune  ( 源義経 ? ),Assassin,4.0,Female,D,C,A++,B,A,B,12,1576,9456.0,11449.0,1692,10580.0,12828.0,Hayami Saori,Sakamoto Mineji,Man,Semi Reverse S,102,25.3%,0.54%,4%,38.5%,Neutral・Summer,"Brynhildr's Beloved, Female, Genji, Humanoid, Riding, Servant, Weak to Enuma Elish",QQQAB
219,Jeanne d'Arc (Berserker Alter),ジャンヌ・ダルク〔オルタ〕,Summer Jalter,Berserker,4.0,Female,B,D,A,B,D,EX,12,1716,10298.0,12469.0,1587,9922.0,12030.0,Sakamoto Maaya,Takeuchi Takashi,Man,Linear,9,5%,0.52%,5%,45.5%,Chaotic・Summer,"Female, Humanoid, Saberface, Servant, Weak to Enuma Elish",QABBB
220,B B (Summer),BB,"BB (Pele), BB-thotep, Nyarlathotep",Moon Cancer,5.0,Female,C,C,C,A++,EX,EX,16,1728,11182.0,12240.0,2172,14812.0,16227.0,Shitaya Noriko,Wada Arco,Earth,S,52,14.8%,0.61%,3%,0.5%,Chaotic・Evil,,QAABB
221,Medb (Saber),女王メイヴ,Queen Medb (Saber),Saber,4.0,Female,C,D,B,D,EX,A+,12,1336,8017.0,9707.0,2177,13609.0,16501.0,Sakura Ayane,Takayama Kisai,Earth,Reverse S,104,10%,0.72%,3%,31.5%,Chaotic・Evil,"Female, Humanoid, King, Riding, Servant, Weak to Enuma Elish",QAABB
222,Mysterious Heroine XX,謎のヒロインＸＸ,"MHXX, Mysterious Heroine X (Foreigner)",Foreigner,4.0,Female,B,B,B,E,D,EX,12,1625,9751.0,11806.0,1800,11250.0,13640.0,Kawasumi Ayako,BUNBUN,Star,Reverse S,147,15%,0.64%,3%,10%,Lawful・Good,"Arthur, Brynhildr's Beloved, Dragon, Existence Outside the Domain, Female, Humanoid, King, Riding, Saberface, Servant",QAABB
223,Diarmuid Ua Duibhne (Saber),ディルムッド・オディナ,,Saber,4.0,Male,B+,B,A,D,E,A,12,1674,10048.0,12166.0,1818,11362.0,13776.0,Midorikawa Hikaru,Azusa,Earth,Linear,97,10.2%,0.73%,3%,31.5%,Lawful・Neutral,"Brynhildr's Beloved, Humanoid, Male, Riding, Servant, Weak to Enuma Elish",QQABB
224,Sitonai,シトナイ,"Illyasviel von Einzbern , Freyja, Louhi",Alter Ego,5.0,Female,E,D,A,EX,A,A,16,1803,11668.0,12772.0,2048,13965.0,15299.0,Kadowaki Mai,BLACK,Sky,Semi Reverse S,102,10.2%,0.83%,4%,25%,Chaotic・Good,"Children Servants, Divine, Female, Humanoid, Illya, Pseudo-Servant, Servant, Weak to Enuma Elish",QAABB
225,Shuten Dōji (Caster),酒呑童子,"Magifender Girl Oni Cure  ( 護法少女・ 鬼救阿 おにきゅあ ,  Gohō Shōjo Onikyua ? )",Caster,4.0,Female,C+,B,B,A+,B,C,12,1589,9538.0,11549.0,1764,11025.0,13368.0,Yūki Aoi,Honjou Raita,Earth,,50,11%,0.46%,3%,34.5%,Chaotic・Evil,"Demonic, Divine, Dragon, Female, Humanoid, Oni, Servant, Shuten Dōji, Weak to Enuma Elish",QAAAB
226,Xiang Yu,項羽,"Kuaiji Zero, 西楚霸王, Xī Chǔ Bà Wáng, Kō U",Berserker,5.0,Male,A,A,A,C,D,C,16,1794,11613.0,12712.0,2019,13770.0,15086.0,Kouichi Yamadera,danciao,Man,S,9,5.1%,0.51%,5%,52%,Lawful・Neutral,,QABBB
227,Lanling Wang,蘭陵王,"Prince of Lan Ling, Lan Ling Wang, Ran-ryō Ō,  Gao Changgong  ( 高长恭 ? )",Saber,4.0,Male,B,B,A+,D,D,B,12,1518,9112.0,11033.0,2020,12625.0,15308.0,Mori Nanako,hou,Man,Reverse S,98,10.2%,0.65%,3%,31.5%,Lawful・Good,"Brynhildr's Beloved, Costume-Owning, Humanoid, Male, Riding, Servant, Weak to Enuma Elish",QAABB
228,Qin Liangyu,秦良玉,Shin Ryō-Gyoku,Lancer,4.0,Female,C,B,A,D,A,B,12,1382,8295.0,10043.0,2142,13387.0,16231.0,Shitaya Noriko,Shimadoriru,Man,S,91,12.1%,0.79%,4%,36%,Lawful・Good,,QQAAB
