id,name,japanese_name,aka,class,stars,gender,strength,endurance,agility,mana,luck,np,cost,min_attack,max_attack,grail_atk,min_hp,max_hp,grail_hp,voice_actor,illustrator,attribute,growth_curve,star_absorption,star_generation,np_charge_atk,np_charge_def,death_rate,alignments,traits,cards
229,Shi Huang Di,始皇帝,"First Emperor,  Qin Shi Huang  ( 秦始皇 ? ),  Ying Zheng  ( 嬴政 ? ),  Zheng, the King of Qin   ( 秦王政 ? ), the Son of Heaven, Shikoutei",Ruler,5.0,Unknown,B+,B+,B+,B+,B+,B+,16,1541,9977.0,10921.0,2321,15828.0,17340.0,Fukuyama Jun,Toh Azuma,Man,Reverse S,100,10%,0.47%,3%,23.6%,Lawful・Good,,QAABB
230,Consort Yu,虞美人,"Yu Mei-ren, Yu the Beauty,  Akuta Hinako  ( 芥ヒナコ ? ) Crimson Beauty Under the Moon  ( 紅の月下美人 ? ), Gubijin, Gucchan",Assassin,4.0,Female,C,A+,D,A+,E,C+,12,1328,7970.0,9650.0,2142,13389.0,16234.0,Ise Mariya,toi8,Earth,Reverse S,97,24.7%,0.75%,4%,31.6%,Lawful・Evil,,QQABB
231,Red Hare,赤兎馬,Sekitoba  ( セキトバ ? ),Rider,3.0,Male,B,EX,B+,C,C,B,7,1194,6434.0,8708.0,1886,10483.0,14214.0,Midorikawa Hikaru,Midorikawa Miho,Earth,Semi Reverse S,198,9%,0.57%,3%,40%,True Neutral,"Beast, Brynhildr's Beloved, Demonic Beast Servant, Humanoid, Riding, Servant, Weak to Enuma Elish",QQAAB
232,Bradamante,ブラダマンテ,"Bradamant, Paladin of the White Feather",Lancer,5.0,Female,B,A+,A,C,D,B,16,1674,10833.0,11858.0,2300,15682.0,17180.0,Morinaga Chitose,saitom,Earth,Linear,88,12.1%,0.7%,4%,32%,Lawful・Good,"Brynhildr's Beloved, Female, Humanoid, Servant, Weak to Enuma Elish",QQAAB
233,Quetzalcoatl (Samba/Santa),ケツァル・コアトル〔サンバ／サンタ〕,,Ruler,4.0,Female,A,B+,B,A,EX,A,12,1614,9687.0,11729.0,1809,11306.0,13708.0,Endou Aya,Hiroe Rei,Sky,Reverse S,104,10%,0.71%,3%,21%,Lawful・Good,"Costume-Owning, Divine, Female, Humanoid, King, Servant, Weak to Enuma Elish",QQABB
234,Beni-enma,紅閻魔;  舌斬り雀の紅閻魔,Tongue-Cut Sparrow Benienma,Saber,5.0,Female,C,E,A++,B,B,B,16,1793,11607.0,12706.0,2047,13960.0,15294.0,Kuno Misaki,Harada Takehito,Earth,S,100,10.3%,0.56%,3%,24.5%,Lawful・Good,"Children Servants, Female, Humanoid, Oni, Servant, Weak to Enuma Elish",QAABB
235,Li Shuwen,李書文,"Royal Guard Chief  ( 衛士長,  Ēshi-chō ? );  Massage Expert  ( 按摩の達人,  Anma no Tatsujin ? ), Old Li,  Security Guard  ( 警備員,  Kēbiin ? ), Captain of the Guard (NA),",Assassin,5.0,Male,C,D,A+,E,E,-,16,1772,11470.0,12556.0,1843,12568.0,13769.0,Yasui Kunihiko,Wada Arco,Man,S,97,25.3%,0.99%,4%,55%,Neutral・Evil,,QAABB
236,Miyu Edelfelt,美遊・エーデルフェルト ;  朔月美遊,"Sakatsuki Miyu  ( 朔月美遊 ? ),  Emiya Miyu  ( 衛宮美遊 ? ),  Child of God  ( 神稚児,  Kami Chigo ? )",Caster,4.0,Female,E,D,C,A,C,A,12,1438,8629.0,10448.0,1920,12005.0,14556.0,"Nazuka Kaori, Kakazu Yumi",Hiroyama Hiroshi,Man,S,49,10.9%,0.81%,3%,36%,Lawful・Good,"Children Servants, Female, Humanoid, Living Human, Pseudo-Servants, Servant, Weak to Enuma Elish",QAAAB
237,Murasaki Shikibu,紫式部,"Fujiwara no Kaoruko  ( 藤原香子 ? ), Lady Murasaki",Caster,5.0,Female,E,E,D,B,A+,C,16,1757,11374.0,12451.0,1882,12833.0,14059.0,Kayano Ai,Honjou Raita,Man,S,51,10.7%,0.45%,3%,42%,Neutral・Good,"Humanoid, Female, Servant, Weak to Enuma Elish",QQAAB
238,Kingprotea,キングプロテア,"Alter Ego G,  Tiamat",Alter Ego,5.0,Female,EX,EX,A,D,B,E,16,1983,12835.0,14050.0,1956,13338.0,14612.0,Han Megumi,Wada Arco,Earth,Reverse S,100,10.2%,0.56%,4%,45%,Lawful・Good,"Divine, Giant, Female, Humanoid, Mechanical, Servants, Super Large, Weak to Enuma Elish",QAABB
239,Kama,カーマ,"Kamadeva  ( カーマデーヴァ ? ),  Matou Sakura  ( 間桐桜,  Matō Sakura ? ),  Beast III/L",Assassin,5.0,Female,D,B+,B,A+,B,C,16,1781,11528.0,12619.0,1890,12889.0,14120.0,Shitaya Noriko,ReDrop,Sky,Semi S,100,25%,0.74%,4%,31.6%,Chaotic・Evil,"Children Servants (Stage 1) , Divine, Female, Humanoid, Pseudo-Servant, Riding, Servant, Weak to Enuma Elish",QQABB
240,Beast III/L,ビーストⅢ／L,"Kama/Mara  ( カーマ／マーラ ? ),  Kama ,  Demon Lord of Lust  ( 愛欲の魔王 ? ),  Lapse",Beast III,5.0,Female,C,EX,A,EX,B,EX,16,2080,13464.0,,2745,18720.0,,Shitaya Noriko,ReDrop,Beast,Linear,100,10.2%,0.58%,3%,0%,Chaotic・Evil,"Demonic, Divine, Female, Humanoid, King, Pseudo-Servants",QQABB
241,Sima Yi (Reines),司馬懿〔ライネス〕,"Reines El-Melloi Archisorte  ( ライネス・エルメロイ・アーチゾルテ ? ), Sima Zhongda",Rider,5.0,Female,B,C,C,A,A+,B,16,1766,11427.0,12509.0,1986,13543.0,14837.0,Minase Inori,Sakamoto Mineji,Man,Linear,205,8.9%,0.64%,3%,30%,True Neutral,"Female, Humanoid, Living Human, Pseudo-Servant, Riding, Servant, Weak to Enuma Elish",QQAAB
242,Astraea,アストライア,"Luviagelita Edelfelt  ( ルヴィアゼリッタ・エーデルフェルト ? ), Lady Justice",Ruler,4.0,Female,A+,A+,D,EX,B,A+,12,1622,9734.0,11786.0,1845,11531.0,13981.0,Itō Shizuka,Toh Azuma,Sky,Semi Reverse S,100,9.9%,0.43%,3%,17.5%,Lawful・Good,"Divine, Female, Humanoid, Living Human, Pseudo-Servant, Roman, Servants, Weak to Enuma Elish",QAABB
243,Gray,グレイ,,Assassin,4.0,Female,B,C,B,C,C,A+,12,1576,9456.0,11449.0,1692,10580.0,12828.0,"Ueda Reina, Ono Daisuke",Sakamoto Mineji,Man,S,99,25%,0.71%,4%,44%,Lawful・Good,"Female, Humanoid, Living Human, Pseudo-Servants, Saberface, Servants, Weak to Enuma Elish",QQQAB
244,Jinako Carigiri,大いなる石像神 ;  ジナコ＝カリギリ,"Ganesha  ( ガネーシャ ? ),  Great Statue God",Moon Cancer,5.0,Female,B,A++,E,B,A,C,16,1416,9166.0,10034.0,2617,17844.0,19549.0,Yūki Aoi,Wada Arco,Sky,S,51,14.5%,0.35%,3%,0.7%,Lawful・Good,"Divine, Female, Humanoid, Living Human, Pseudo-Servant, Riding, Servant, Weak to Enuma Elish",QAAAB
245,Lakshmibai,ラクシュミー・バーイー,"Rani of Jhansi,  Jeanne d'Arc  of India",Saber,4.0,Female,B,B,B,C,E-,A,12,1658,9949.0,12046.0,1818,11362.0,13776.0,Rina Satou,Takeuchi Takashi,Man,Reverse S,96,10%,1.01%,3%,28%,Lawful・Good,"Divine, Female, Humanoid, Riding, Saberface, Servant, Weak to Enuma Elish",QQABB
246,William Tell,ウィリアム・テル,"Wilhelm Tell, Guillermo Tell",Archer,3.0,Male,B,B,B,E,C,B,7,1371,7384.0,9993.0,1675,9310.0,12623.0,Hayato Fujii,Takahashi Keitarō,Man,Semi S,148,8%,0.66%,3%,45%,Lawful・Good,,QAABB
247,Arjuna (Alter),アルジュナ〔オルタ〕,"Deified Arjuna  ( 神たるアルジュナ ? ),  The Final Dark God  ( 黒き最後の神 ? )",Berserker,5.0,Male,A,A+,A,A++,C,EX,16,1803,11669.0,12773.0,2029,13837.0,15159.0,Shimazaki Nobunaga,pako,Sky,Reverse S,9,5.1%,0.98%,5%,35.7%,Lawful・Good & Evil,"Divine, Humanoid, Male, Servant, Weak to Enuma Elish",QABBB
248,Aśvatthāman,アシュヴァッターマン,"Aśvatthāmā, Ashwatthama",Archer,4.0,Male,B,A,A++,B,A,A+,12,1708,10249.0,12409.0,1799,11245.0,13634.0,Tatsuhisa Suzuki,pako,Sky,Linear,153,8.1%,0.58%,3%,31.5%,Chaotic・Neutral,"Brynhildr's Beloved, Divine, Humanoid, Male, Servant, Weak to Enuma Elish",QQABB
249,Asclepius,アスクレピオス,"God of Medicine, Hepius",Caster,3.0,Male,D,D,B,A,D,A+,7,1184,6376.0,8629.0,1815,10084.0,13672.0,Suzuki Ryouta,Teita,Earth,Linear,49,11%,0.81%,3%,36%,True Neutral,"Argo-Related, Divine, Greek Mythology Males, Humanoid, Male, Servant, Weak to Enuma Elish",QAAAB
250,Demon King Nobunaga,織田信長 ;  織田吉法師 ;  魔王信長,"Oda Nobunaga (Avenger), Oda Kippōshi, Maou Nobunaga",Avenger,5.0,Unknown,B,C,C,B,B,A-,16,1953,12641.0,13838.0,1724,11761.0,12885.0,Kugimiya Rie,pako,Earth,S,30,5.9%,0.49%,5%,7%,Chaotic・Neutral,"Feminine Looking, Humanoid, King, Nobunaga, Servant, Weak to Enuma Elish",QABBB
251,Mori Nagayoshi,森長可,"Demon Musashi  ( 鬼武蔵,  Oni Musashi ? ), Mori-kun",Berserker,3.0,Male,B,C,D,E,D,C,7,1436,7732.0,10464.0,1443,8019.0,11510.0,Taniyama Kishou,Dd,Man,Linear,9,4.9%,0.5%,5%,65%,Chaotic・Insane,"Male, Humanoid, Servant, Weak to Enuma Elish",QAABB
252,Nagao Kagetora,長尾景虎,"Uesugi Kenshin  ( 上杉謙信 ? ),  Dragon of Echigo  ( 越後の龍 ? ),  Lancer of Eight Flowers  ( 八華のランサー ? )",Lancer,4.0,Female,C,C,A,D+,C+,B,12,1602,9617.0,11644.0,1817,11360.0,13774.0,Mizuki Nana,Takeuchi Takashi,Man,Reverse S,89,12.2%,0.45%,4%,35%,Lawful・Good,"Costume-Owning, Divine, Female, Humanoid, Riding, Servant, Weak to Enuma Elish",QAABB
253,Leonardo Da Vinci (Rider),レオナルド・ダ・ヴィンチ,"Da Vinci Lily, Loli Vinci, Gran Cavallo",Rider,5.0,Female,D,D,B,A,A+,B,16,1681,10883.0,11913.0,2069,14112.0,15460.0,Sakamoto Maaya,Simosi,Man,S,205,9%,0.49%,3%,30%,Lawful・Good,"Children Servants, Costume-Owning, Female, Humanoid, Riding, Servant",QAABB
254,Jason,イアソン,"Hero Scout, Aeson",Saber,1.0,Male,C,B,B+,D,A+,A,3,992,5457.0,8479.0,1515,7575.0,11677.0,Hoshi Soichirou,BLACK,Earth,Semi Reverse S,102,10%,0.37%,3%,31.5%,Lawful・Good,"Argo-Related, Brynhildr's Beloved, Greek Mythology Males, Humanoid, Male, Riding, Servant, Weak to Enuma Elish",QAABB
255,Paris,パリス,,Archer,2.0,Male,D,C,B,B+,A,A,4,1157,6523.0,9452.0,1474,7834.0,11306.0,Terasaki Yuka,Rin Kususaga,Earth,Semi Reverse S,153,8%,0.43%,3%,30.3%,True Neutral,"Argo-Related, Brynhildr's Beloved, Children Servants, Greek Mythology Males, Humanoid, Male, Servant, Weak to Enuma Elish",QQAAB
256,Gareth,ガレス,,Lancer,2.0,Female,C,B,A,D,D,C,4,960,5413.0,7844.0,1795,9537.0,13764.0,Kuwahara Yuuki,Nekotawawa,Earth,Semi S,88,12.1%,0.71%,4%,36.0%,Lawful・Good,"Brynhildr's Beloved, Female, Humanoid, Riding, Servant, Weak to Enuma Elish",QQABB
257,Bartholomew Roberts,バーソロミュー・ロバーツ,"Black Bart, Salazar ?",Rider,1.0,Male,C,D+,C,D,B,A,3,993,5461.0,8485.0,1344,6720.0,10359.0,Chiaki Kobayashi,Mata,Man,Linear,200,8.9%,0.65%,3%,45%,Chaotic・Evil,"Brynhildr's Beloved, Humanoid, Male, Riding, Servant, Weak to Enuma Elish",QQAAB
258,Chen Gong,陳宮,"Chén gōng, 公臺, Gongtai, Chinkyū",Caster,2.0,Male,C,D,B,B,C,C,4,1085,6119.0,8867.0,1459,7755.0,11192.0,Madono Mitsuaki,Wada Arco,Man,Semi-Reverse S,49,11%,0.4%,3%,42.%,Chaotic・Good,"Male, Humanoid, Servant, Weak to Enuma Elish",QAAAB
259,Charlotte Corday,シャルロット・コルデー,"Angel of Assassination  ( 暗殺の天使,  Ansatsu no Tenshi ? ), Marie-Anne Charlotte Corday d'Armont",Assassin,1.0,Female,E,E,D,E,B+,D,3,997,5488.0,8528.0,1244,6220.0,9588.0,Horie Yui,Aotsuki Takao,Man,Reverse S,100,24.7%,0.52%,4%,55%,Neutral・Good,"Female, Humanoid, Servant, Weak to Enuma Elish",QQAAB
260,Salome,サロメ,Salomé,Berserker,2.0,Female,B,B,B,D,C,B,4,1221,6884.0,9975.0,1296,6885.0,9936.0,Bridcutt Sarah Emi,Simosi,Earth,Semi Reverse S,9,5.0%,0.51%,5%,58.5%,Chaotic・Evil,"Female, Humanoid, Servant, Weak to Enuma Elish",QAABB
261,Miyamoto Musashi (Berserker),宮本武蔵;  新免武蔵守藤原玄信,Shinmen Musashi no Kami Fujiwara no Harunobu Miyamoto Iori (宮本伊織),Berserker,5.0,Female,A+,B,B,C,D,D,16,1964,12712.0,13915.0,1782,12150.0,13311.0,Sakura Ayane,Koyama Hirokazu,Man,Semi S,9,5%,0.51%,5%,52%,Chaotic・Good,"Costume-Owning, Divine, Female, Humanoid, Riding, Servant, Weak to Enuma Elish",QAABB
262,Osakabehime (Archer),刑部姫,Okki,Archer,4.0,Female,D,E,B,A,A,EX,12,1482,8895.0,10770.0,1996,12476.0,15127.0,Fukuen Misato,Moriyama Daisuke,Earth,S,153,8%,0.62%,3%,27%,Neutral・Summer,"Divine, Female, Humanoid, Servant, Weak to Enuma Elish",QAAAB
263,Carmilla (Rider),カーミラ,Mistress・C,Rider,4.0,Female,B,E,A++,D,B,B,12,1608,9651.0,11685.0,1676,10476.0,12702.0,Tanaka Atsuko,okojo,Earth,Reverse S,200,9.1%,0.52%,3%,45%,Neutral・Evil,"Female, Humanoid, Servant, Weak to Enuma Elish",QQAAB
264,Katsushika Hokusai (Saber),葛飾北斎,"Katsushika Oui  ( 葛飾 応為,  Katsushika Ōi ? , Daughter ); Tokitarō, Dragon-Crested Octopus, Darusen,  The Old Man Mad About Art Manji  ( 画狂老人卍,  Gakyō Rōjin Manji ? , Last renamed name )",Saber,4.0,Female,C,C,B,C-,B-,B,12,1564,9389.0,11368.0,1899,11873.0,14396.0,Yukana Nogami,Kuroboshi Kouhaku,Man,Semi Reverse S,99,10%,0.46%,3%,28.8%,Chaotic・Good,"Divine, Female, Humanoid, Servant, Threat to Humanity, Weak to Enuma Elish",QQAAB
265,Artoria Pendragon (Ruler),アルトリア･ペンドラゴン〔ルーラー〕,,Ruler,5.0,Female,C,A+,B,A,B,A+,16,1482,9593.0,10501.0,2480,16912.0,18528.0,Kawasumi Ayako,Ishida Akira,Sky,Linear,100,10.0%,0.57%,3%,21.0%,Lawful・Summer,"Arthur, Dragon, Female, King, Humanoid, Saberface, Servant, Weak to Enuma Elish",QQABB
266,Mysterious Alter Ego Λ,謎のアルターエゴ・Λ ;  ラムダリリス,"Mysterious Alter Ego Lambda, Lambdalilith, Lambdaryllis, Meltlilith (Lancer), Meltryllis (Lancer), Leviathan, Cruel Swim Tutu",Lancer,4.0,Female,C,E,A,B,A,B+,12,1543,9261.0,11213.0,1879,11749.0,14246.0,Hayami Saori,Wada Arco,Earth,Linear,91,12.1%,0.76%,4%,28%,Lawful・Good,"Costume-Owning, Demonic, Divine, Dragon, Female, Humanoid, Mechanical, Riding, Servant, Weak to Enuma Elish",QQAAB
267,Okita J Sōji,"オキタ・Ｊ・ソウジ ,  沖田総司","Okita Jet Sōji, Okita Sōji (Assassin)",Assassin,4.0,Female,D,E,A+,D,C,C,12,1556,9337.0,11305.0,1658,10366.0,12569.0,Yūki Aoi,Takeuchi Takashi,Man,Reverse S,99,25.3%,0.92%,4%,49.5%,Neutral・Summer,"Existence Outside the Domain, Female, Humanoid, Saberface, Servant, Weak to Enuma Elish",QQQAB
268,Space Ishtar,スペース・イシュタル,"Ishtar, Astarte, Ishtar-Astarte, Astoreth",Avenger,5.0,Female,B,EX,B,EX,C+,EX,16,1949,12612.0,13806.0,1912,13041.0,14287.0,Ueda Kana,Morii Shizuki,Star,S,29,6%,0.69%,5%,5%,Lawful・Evil,"Costume-Owning, Divine, Female, Humanoid, Servant",QAABB
269,Calamity Jane,カラミティ・ジェーン,"Martha Jane Canary, Martha Jane Cannary",Archer,4.0,Female,C,A,B,D,A,D,12,1499,8996.0,10892.0,1999,12495.0,15150.0,Touyama Nao,B-suke,Man,Linear,153,8%,0.71%,3%,40.5%,Chaotic・Neutral,"Brynhildr's Beloved, Female, Humanoid, Riding, Servant, Weak to Enuma Elish",QQAAB
270,Astolfo (Saber),アストルフォ,"Knight of Evaporated Sanity  ( 理性蒸発の騎士,  Risei Jōhatsu no Kishi ? ), Sailor Paladin",Saber,5.0,Unknown,C+,C,A,B,A++,B,16,1807,11694.0,12801.0,2089,14248.0,15609.0,Ookubo Rumi,Konoe Ototsugu,Earth,Reverse S,103,10.1%,0.52%,3%,24.5%,Chaotic・Good,"Feminine Looking, Humanoid, Riding, Servant, Weak to Enuma Elish",QQAAB
271,Nightingale (Santa),ナイチンゲール,"Angel of Crimea  ( クリミアの天使,  Kurimia no Tenshi ? ) Florence Nightingale (フローレンス・ナイチンゲール), Mercédès, The White Cloth of Steel, The Lady with the Lamp.",Archer,4.0,Female,D+,B+,B+,D+,A+,B,12,1643,9858.0,11936.0,1772,11080.0,13434.0,Sawashiro Miyuki,Takahashi Keitarō,Man,Linear,153,8%,0.6%,3%,39.3%,Lawful・Good,"Female, Humanoid, Servant, Weak to Enuma Elish",QQAAB
272,Super Orion,超人オリオン,"Orion , Superhuman Orion",Archer,5.0,Male,A,A,B+,C,A,EX,16,1940,12557.0,13746.0,1979,13494.0,14783.0,Canna Nobutoshi,I-IV,Earth,Semi Reverse S,153,8%,0.96%,3%,36%,Chaotic・Neutral,"Brynhildr's Beloved, Divine, Greek Mythology Males, Humanoid, Male, Servant, Weak to Enuma Elish",QABBB
273,Mandricardo,マンドリカルド,"Rodomonte, My Friend",Rider,3.0,Male,C,B,A,C,B,A,7,1254,6756.0,9143.0,1728,9600.0,13016.0,Masuda Toshiki,Ginka,Man,S,200,9%,0.86%,3%,40%,True Neutral,"Brynhildr's Beloved, Humanoid, King, Male, Riding, Servant, Weak to Enuma Elish",QQAAB
274,Europa,エウロペ,Europe,Rider,5.0,Female,E,E,D,B,A,A,16,1813,11737.0,12848.0,1843,12571.0,13219.0,M・A・O,redjuice,Sky,Linear,205,8.9%,0.58%,3%,35%,Neutral・Good,"Divine, Female, Humanoid, Riding, Weak to Enuma Elish",QAABB
275,Yang Guifei,楊貴妃,"Yang Yuhuan  ( 楊玉環 ヤン・ユーファン ? ), Cthugha, Youkihi, Yuyu",Foreigner,5.0,Female,D,C,B,A,D,B+,16,1907,12342.0,13510.0,1960,13365.0,14642.0,Haruka Yoshimura,Kuroboshi Kouhaku,Man,Linear,147,15%,0.51%,3%,6%,Chaotic・Good,"Divine, Existence Outside the Domain, Female, Humanoid, Servant, Threat to Humanity, Weak to Enuma Elish",QQAAB
276,Sei Shōnagon,清少納言,"Sparkling Archer  ( キラキラのアーチャー ? ), Nagiko(諾子)",Archer,5.0,Female,E,D,B,C,A,D++,16,1888,12218.0,13374.0,1901,12965.0,14204.0,Ai Fairouz,Mika Pikazo,Man,Semi S,153,8%,0.57%,3%,36%,Chaotic・Good,"Female, Humanoid, Servant, Weak to Enuma Elish",QQAAB
277,Odysseus,オデュッセウス,"Ulysses, Vlixes",Rider,5.0,Male,C,A+,D,B+,EX,B,16,1822,11795.0,12911.0,1948,13284.0,14553.0,Takuya Kirimoto,redjuice,Earth,Reverse S,208,8.9%,0.58%,3%,33.7%,Neutral・Good,"Brynhildr's Beloved, Greek Mythology Males, Humanoid, King, Male, Riding, Servant, Weak to Enuma Elish",QQAAB
278,Dioscuri,ディオスクロイ,"Dioskouroi, the Gemini Twins, Castor & Pollux(カストロ & ポルクス)",Saber,5.0,Unknown,A,A++,B,C,C,B,16,1829,11840.0,12961.0,2174,14824.0,16240.0,"Uchida Yuuma, Uchida Maaya",Taiki,Sky,Semi Reverse S,99,10%,0.51%,3%,28%,Chaotic・Neutral,"Argo-Related, Brynhildr's Beloved, Divine, Feminine Looking, Humanoid, Riding, Servant, Weak to Enuma Elish",QQAAB
279,Caenis,カイニス,"Caeneus,  Poseidon's Proxy , Golden Caenis(黄金のカイニス)",Lancer,4.0,Unknown,A,B+,A,D,B,C,12,1649,9896.0,11982.0,1845,11532.0,13982.0,Komatsu Mikako,Azusa,Earth,Linear,90,12.2%,0.86%,4%,36%,Neutral・Evil,"Argo-Related, Brynhildr's Beloved, Divine, Feminine Looking, Humanoid, King, Servant, Weak to Enuma Elish",QQABB
280,Romulus-Quirinus,ロムルス＝クィリヌス,"Romulus , Quirinus, Janus Quirinus, The Divine Ancestor, King of Nation Building, Roma",Lancer,5.0,Unknown,A,C,A,B++,EX,A,16,1896,12273.0,13435.0,1999,13632.0,14934.0,Okiayu Ryoutarou,Koyama Hirokazu,Sky,Semi Reverse S,93,12.2%,0.59%,4%,26%,Chaotic・Neutral,"Divine, Humanoid, Roman, Servant, Weak to Enuma Elish",QAABB
281,Voyager,ボイジャー,"Voyager 1, Little Prince, Pran",Foreigner,5.0,Male,E,C,A+,B,A,B,16,1615,10450.0,11439.0,2286,15592.0,17082.0,Iguchi Yuka,NOCO,Star,Linear,153,15.1%,0.56%,3%,7%,Neutral・Good,"Children Servants, Existence Outside the Domain, Humanoid, Male, Servant",QQAAB
282,Kijyo Kōyō,鬼女紅葉,Momiji  ( 紅葉 ? ),Berserker,4.0,Female,B,B,D,B,D,C,12,1529,9177.0,11111.0,1800,11250.0,13640.0,Hikasa Yōko,NOCO,Earth,Semi Reverse S,9,4.9%,0.85%,5%,45.5%,Neutral・Evil,"Demonic, Demonic Beast Servants (Stage 1) , Dragon, Female, Humanoid, Oni, Servant, Weak to Enuma Elish",QABBB
283,Utsumi Erice,宇津見エリセ,"Erichi, Grim Reaper",Lancer,4.0,Female,C,C,B,C,E,B,12,1520,9122.0,11045.0,1918,11991.0,14539.0,Kitō Akari,NOCO,Man,Semi S,87,12%,0.63%,4%,32%,Lawful・Neutral,"Children Servants, Divine, Female, Humanoid, Living Human, Riding, Servant, Weak to Enuma Elish",QQAAB
284,Artoria Caster,アルトリア・キャスター,"Castoria, CasSeiba",Caster,5.0,Female,B,D,B,A,B,A++,16,1629,10546.0,11544.0,2112,14406.0,15782.0,Kawasumi Ayako,Takeuchi Takashi,Star,S,50,11%,0.54%,3%,36%,Neutral・Good,"Arthur, Female, Humanoid, Saberface, Servant",QAAAB
285,Sesshōin Kiara (Moon Cancer),殺生院キアラ,"Yao Bikuni  ( 八百比丘尼 ? ), Sessyoin Kiara, Sesshouin Kiara",Moon Cancer,5.0,Female,C,A+,C,A+,B,A+,16,1719,11128.0,12181.0,2249,15336.0,16801.0,Tanaka Rie,Wada Arco,Earth,S,50,14.8%,0.6%,3%,0.5%,Lawful・Evil,"Demonic Beast Servants (Stage 3) , Female, Humanoid, Servant, Weak to Enuma Elish",QAABB
286,Illyasviel von Einzbern (Archer),イリヤスフィール・フォン・アインツベルン,Illya,Archer,4.0,Female,C,C,B,B,C-,A,12,1683,10098.0,12226.0,1746,10914.0,13233.0,"Kadowaki Mai, Takano Naoko",Hiroyama Hiroshi,Man,Semi Reverse S,148,8%,0.63%,3%,31.5%,Neutral・Summer,"Children Servants, Female, Humanoid, Illya, Living Human, Pseudo-Servants, Servant, Weak to Enuma Elish",QQAAB
287,Brynhildr (Berserker),ブリュンヒルデ,"Brynhild (Brünnhilde), Sigrdrífa",Berserker,4.0,Female,C,C,A,B,EX,B,12,1699,10197.0,12346.0,1603,10023.0,12153.0,Noto Mamiko,Miwa Shirō,Sky,Semi Reverse S,10,5.1%,0.85%,5%,45.5%,Neutral・Good,"Divine, Female, Humanoid, Servant, Weak to Enuma Elish",QABBB
288,Consort Yu (Lancer),虞美人,"Yu Mei-ren, Yu the Beauty,  Akuta Hinako  ( 芥ヒナコ ? ) Crimson Beauty Under the Moon  ( 紅の月下美人 ? ), Gubijin, Gucchan",Lancer,4.0,Female,B,D,A,A,C,C,12,1649,9896.0,11982.0,1799,11245.0,13634.0,Ise Mariya,toi8,Earth,Reverse S,89,12.2%,1.1%,4%,24%,Lawful・Evil,"Demonic, Humanoid, Female, Servant, Weak to Enuma Elish",QQABB
289,Abigail Williams (Summer),アビゲイル・ウィリアムズ,"The Key to the Gate, Sut-Typhon, Yog-Sothoth, All-in-One, One-in-All, Abby",Foreigner,5.0,Female,C,B,B,A,B,A,16,1820,11781.0,12896.0,2090,14250.0,15611.0,Ōwada Hitomi,Kuroboshi Kouhaku,Earth,S,150,15%,0.86%,3%,6%,Lawful・Evil,"Children Servants, Divine, Existence Outside the Domain, Female, Humanoid, Servant, Threat to Humanity",QQABB
290,Tomoe Gozen (Saber),巴御前,,Saber,4.0,Female,B,A,B,B,A,B,12,1590,9544.0,11556.0,1957,12233.0,14832.0,Kanemoto Hisako,Shirabi,Earth,Linear,102,10%,0.55%,3%,24.5%,Neutral ・ Good,"Demonic, Female, Genji, Humanoid, Oni, Riding, Servant, Weak to Enuma Elish",QAABB
291,Murasaki Shikibu (Rider),紫式部,"Fujiwara no Kaoruko  ( 藤原香子 ? ), Lady Murasaki",Rider,4.0,Female,E,C,D,B,A+,C,12,1455,8730.0,10570.0,1900,11880.0,14404.0,Kayano Ai,Honjou Raita,Man,Linear,205,8.8%,0.53%,3%,35%,Neutral・Good,"Female, Humanoid, Riding, Servant, Weak to Enuma Elish",QQAAB
292,Himiko,卑弥呼,Shingi Waō  ( 親魏倭王 ? ),Ruler,5.0,Female,B++,B,C,A,B,B,16,1647,10659.0,11668.0,2200,15000.0,16433.0,Tamura Yukari,toi8,Earth,Reverse S,100,9.9%,0.57%,3%,21%,Chaotic・Good,"Female, Humanoid, King, Servant, Weak to Enuma Elish",QAABB
293,Saitō Hajime,斎藤一,Hajime-chan,Saber,4.0,Male,B,C,B+,E,A,C,12,1570,9425.0,11412.0,1899,11873.0,14396.0,Ishikawa Kaito,Ikezawa Shin,Man,Linear,102,10%,0.76%,3%,35%,Lawful ・ Neutral,"Humanoid, Male, Servant, Weak to Enuma Elish",QAABB
294,Oda Nobukatsu,織田信勝,Kattsu,Archer,1.0,Male,D,D,C,E,E,D,3,930,5116.0,7949.0,1512,7563.0,11659.0,"Yamashita Daiki, Kugimiya Rie",pako,Man,Reverse S,145,7.9%,0.75%,3%,45%,Chaotic・Good,"Humanoid, Male, Servant, Weak to Enuma Elish",QQABB
295,Van Gogh,ヴァン・ゴッホ,"Vincent Van Gogh  ( ヴィンセント・ヴァン・ゴッホ ? ),  Clytie  ( クリュティエ ? ) ,  Clytie Van Gogh  ( クリュティエ＝ヴァン・ゴッホ ? )",Foreigner,5.0,Female,E,B,C,A,D,A+,16,1734,11220.0,12282.0,2200,15000.0,16433.0,Takahashi Karin,Kibadori Rue,Earth,Semi Reverse S,147,14.9%,0.76%,3%,6%,Chaotic・Evil,"Children Servants, Divine, Existence Outside the Domain, Female, Humanoid, Servant, Threat to Humanity, Weak To Enuma Elish",QQQAB
296,Nemo,ネモ,"Captain Nemo, Captain, Prince, Nameless, Prince Dakkar, Triton",Rider,5.0,Male,C,B,C,A,A,B,16,1766,11427.0,12427.0,2006,13680.0,14680.0,Hanamori Yumiri,DANGERDROP,Sky,Semi S,204,8.9%,0.59%,3%,30%,Chaotic・Neutral,"Argo-Related, Brynhildr's Beloved, Divine, Greek Mythology Males, Male, Riding, Humanoid, Servant, Weak to Enuma Elish",QAABB
297,Ashiya Dōman,蘆屋道満,"Dōma Hōshi  ( 道摩法師 ? ),  Caster  Limbo  ( キャスター・リンボ ? ) ,  Rasetsu-Ō・Cranial Eboshi Ashiya Dōman  ( 羅刹王・髑髏烏帽子蘆屋道満 ? )",Alter Ego,5.0,Unknown,C,D,E,EX,B,B,16,1893,12252.0,13412.0,1945,13266.0,14533.0,Morikawa Toshiyuki,Furumi Showichi,Earth,Sem Reverse S,100,9.7%,0.7%,4%,25%,Chaotic・Evil,"Demonic, Divine, Humanoid, Servant, Weak to Enuma Elish",QQAAB
298,Watanabe no Tsuna,渡辺綱,,Saber,4.0,Male,B,C,A+,C,B,B,12,1687,10123.0,12257.0,1799,11248.0,13638.0,Akabane Kenji,Hidari,Man,Semi Reverse S,100,10.2%,0.6%,3%,28%,Neutral・Good,"Brynhildr's Beloved, Genji, Humanoid, Riding, Servant, Weak to Enuma Elish",QAABB
299,Ibuki Dōji,伊吹童子,Shuten Dōji,Saber,5.0,Female,A+,C,C,EX,D,A+,16,1964,12709.0,13912.0,1979,13498.0,14788.0,Yūki Aoi,Honjou Raita,Sky,Linear,98,9.9%,0.78%,3%,17.5%,Chaotic・Good,"Costume-Owning, Demonic, Demonic Beast Servant, Divine, Dragon, Female, Giant, Oni, Riding, Servant, Weak to Enuma Elish",QABBB
300,Vritra,ヴリトラ,,Lancer,5.0,Female,A,C,A,A,D,EX,16,1905,12332.0,13499.0,1999,13632.0,14934.0,Asahina Madoka,La-na,Sky,Semi Reverse S,88,12.2%,0.55%,4%,24%,Neutral・Evil,"Demonic, Demonic Beast Servant, Dragon, Humanoid, Servant, Weak to Enuma Elish",QQAAB
301,Karna (Santa),カルナ〔サンタ〕,,Saber,4.0,Male,B,A,EX,D,C,A,12,1530,9180.0,11115.0,2060,12877.0,15613.0,Yusa Kouji,pako,Sky,,99,10.2%,0.78%,3%,31.5%,Lawful・Good,"Divine, Humanoid, Servant, Weak to Enuma Elish",QQABB
302,Senji Muramasa,千子村正,"Sengo Muramasa,  Emiya Shirou  ( 衛宮士郎,  Emiya Shirō ? )",Saber,5.0,Male,B,A,D,E,B,A+,16,1757,11373.0,12449.0,2153,14680.0,16083.0,Sugiyama Noriaki,Takeuchi Takashi,Man,Semi S,100,9.8%,0.59%,3%,35%,Chaotic・Neutral,"Living Human, Humanoid, Male, Pseudo-Servant, Servants, Weak to Enuma Elish",QAABB
303,Taira no Kagekiyo,平景清,"Kurō Hōgan Yoshitsune  ( 九郎判官義経 ? ),  Minamoto no Yoshitsune  ( 源義経 ? )",Avenger,5.0,Unknown,D,A,A+,B,B,B+,16,1963,12705.0,13908.0,1777,12117.0,13275.0,Hayami Saori,Sakamoto Mineji,Earth,Linear,30,6.1%,0.81%,5%,7%,Chaotic・Evil,"Brynhildr's Beloved, Feminine Looking Servant, Genji, Humanoid, Servant, Weak to Enuma Elish",QQAAB
304,Kiichi Hōgen,鬼一法眼,"Kiichi Hougen, Oniichi Hōgen, Sōjōbō, Soujoubou",Assassin,4.0,Unknown,D,C,A+,EX,B,A+,12,1572,9434.0,11423.0,1786,11168.0,13541.0,Kakuma Ai,Ohmori Aoi,Earth,Semi Reverse S,100,25.6%,0.56%,4%,27.5%,Chaotic・Neutral,"Demonic, Feminine Looking, Humanoid, Servant, Weak to Enuma Elish",QQABB
